{
  "schema_version": "1.0",
  "gate_id": "production-readonly-promotion-v1",
  "status": "blocked_pending_approval",
  "owners": {
    "business_owner": null,
    "data_owner": null,
    "security_owner": null,
    "engineering_owner": null
  },
  "thresholds": {
    "business_correctness_min": null,
    "permission_leakage_max": 0,
    "city_or_version_drift_max": 0,
    "blocked_quality_execution_max": 0,
    "truncation_misstatement_max": 0,
    "unsupported_number_rate_max": 0,
    "deterministic_baseline_regression_max": 0,
    "query_timeout_seconds_max": null,
    "query_cost_budget_max": null,
    "database_timeout_retry_policy": "no_automatic_retry"
  },
  "required_artifacts": {
    "signed_business_semantics_decision": {"status": "pending", "approval_ref": null},
    "signed_data_egress_decision": {"status": "pending", "approval_ref": null},
    "source_profile_manifest_with_hash": {"status": "pending", "approval_ref": null},
    "source_to_logical_mapping_approval": {"status": "pending", "approval_ref": null},
    "business_gold_case_approval": {"status": "pending", "approval_ref": null},
    "permission_and_idor_test_report": {"status": "pending", "approval_ref": null},
    "database_load_test_report": {"status": "pending", "approval_ref": null},
    "uat_signoff": {"status": "pending", "approval_ref": null}
  },
  "promotion_rule": "all owners, numeric thresholds, and required artifacts must be approved"
}
